Name,Price,Description,,,
Wilson AVP Official Beach Volleyball,$29.99 ,Official volleyball for the AVP tour, ideal for outdoor play.,,
Mikasa V200W Indoor Volleyball,$59.99 ,Premium indoor volleyball used in professional competitions.,,,
Spalding Pro-Tec Beach Volleyball,$24.99 ,Durable and weather-resistant volleyball for beach play.,,,
Nike Volleyball Knee Pads,$19.99 ,Protective knee pads designed for comfort and support during play.,,,
ASICS Gel Volleyball Shoes,$79.99 ,High-performance shoes with gel cushioning for stability on the court.,,,
Under Armour Performance Sports Bra,$34.99 ,Supportive sports bra designed for active volleyball players.,,,
Mikasa MVA200 FIVB Official Volleyball,$89.99 ,Official FIVB game ball for international competitions.,,,
Tachikara SV5W Soft Play Volleyball,$19.99 ,Soft-touch volleyball for recreational play, ideal for beginners.,,
Wilson Soft Play Volleyball,$18.99 ,Soft and durable volleyball suitable for all skill levels.,,,
Molten Super Touch Volleyball,$44.99 ,High-quality volleyball with a premium grip for indoor play.,,,
BeachMate Sand Court Volleyball Net Set,$199.99 ,Complete net set for setting up a volleyball court on the beach.,,,
EastPoint Sports Volleyball Set,$129.99 ,Complete volleyball set with net, poles, and ball for recreational play.,
Mikasa Tournaments Series Volleyball,$39.99 ,Durable volleyball for competitive indoor play.,,,
Champion Sports Official Volleyball Net,$89.99 ,Heavy-duty volleyball net designed for both indoor and outdoor use.,,,
Adidas Performance Volleyball Shorts,$24.99 ,Comfortable and breathable shorts for volleyball players.,,,
Tachikara Basketball/Volleyball Combo Ball,$16.99 ,Multi-use ball that can be used for both volleyball and basketball.,,,
Nike Dri-FIT Volleyball Socks,$12.99 ,Moisture-wicking socks designed to keep feet dry during intense matches.,,,
Wilson Pro Tour Volleyball Bag,$49.99 ,Spacious bag designed to carry volleyball gear and accessories.,,,
Spalding Volley Max Volleyball,$29.99 ,High-quality volleyball designed for intense practice sessions.,,,
Mikasa MB5 Outdoor Volleyball,$34.99 ,Weather-resistant outdoor volleyball perfect for recreational play.,,,
Molten V5M5000 FIVB Official Game Ball,$79.99 ,Internationally recognized volleyball used in FIVB competitions.,,,
Kemp 6-Inch Volleyball Knee Pads,$14.99 ,Comfortable knee pads offering essential protection for volleyball players.,,,
Under Armour Compression Shorts,$24.99 ,Compression shorts that provide muscle support and flexibility.,,,
Nike Vapor Volleyball Shoes,$89.99 ,Lightweight and durable shoes designed for explosive movements on the court.,,,
Spalding Junior Volleyball Set,$39.99 ,Complete volleyball set for beginners, including a net, ball, and pump.
Tachikara Official Game Volleyball,$29.99 ,Official game volleyball designed for serious indoor play.,,,
Wilson Red Volleyball Net,$99.99 ,High-quality volleyball net perfect for outdoor and indoor play.,,,
Mikasa Beach Volleyball Set,$149.99 ,Complete volleyball set including a ball, net, and poles for beach play.,
Libero Volleyball Jersey,$39.99 ,Comfortable and breathable jersey designed for libero players.,,,
Volleyball Net Anchors,$29.99 ,Heavy-duty anchors to secure the volleyball net in place during outdoor play.,,,
Tachikara SV-MN VolleyLite Volleyball,$22.99 ,Lightweight volleyball designed for younger players or casual games.,,,
Mikasa K5 Volleyball,$59.99 ,High-performance volleyball for competitive indoor play.,,,
Under Armour Volleyball Shorts,$19.99 ,Stretchable and breathable shorts designed for volleyball players.,,,
Wilson FIBA Volleyball,$69.99 ,Official volleyball for international competition under the FIBA standard.,,,
Nike Team Sportswear Volleyball Hoodie,$49.99 ,Cozy and stylish hoodie for volleyball players to wear between games.,,,
Molten V5M5000 Volleyball,$64.99 ,Top-quality volleyball used in professional indoor tournaments.,,,
Mikasa 6-Inch High Jump Knee Pads,$24.99 ,Specialized knee pads providing extra cushioning for high jumpers.,,,
Spalding All Sports Volleyball,$19.99 ,Affordable all-sports volleyball for recreational use.,,,
Champion Sports Volleyball Referee Whistle,$7.99 ,Durable whistle for referees, perfect for volleyball matches.,,
Wilson Pro Series Volleyball Bag,$39.99 ,Stylish bag designed to hold your volleyball gear.,,,
Mikasa Soft Touch Volleyball,$21.99 ,Soft-touch volleyball suitable for indoor or outdoor play.,,,
Tachikara T2 Volleyball Ball,$27.99 ,Entry-level volleyball with great durability for practice and recreational play.,,,
Adidas Essential Volleyball Shirt,$29.99 ,Comfortable and moisture-wicking shirt perfect for volleyball practice.,,,
Libero Volleyball Shorts,$24.99 ,Flexible and lightweight shorts designed specifically for libero players.,,,
Mikasa VSN Indoor Volleyball,$34.99 ,Durable indoor volleyball designed for competitive play.,,,
Wilson Beach Volleyball Set,$119.99 ,Complete set with net, poles, and ball for beach volleyball enthusiasts.,
Nike Performance Volleyball Tank,$27.99 ,Lightweight and breathable tank top for volleyball players.,,,
Tachikara SV5W Soft Play Volleyball,$19.99 ,Soft volleyball perfect for beginner players or casual games.,,,
Mikasa Pro Series Beach Volleyball,$54.99 ,High-quality beach volleyball with a strong grip for outdoor play.,,,
Knee Compression Sleeve,$14.99 ,Provides additional knee support and reduces strain during volleyball matches.,,,
Molten V4M5000 Volleyball,$59.99 ,Official Molten volleyball used in competitive indoor tournaments.,,,
Champion Sports Volleyball Net System,$179.99 ,Complete net system with adjustable height for competitive matches.,,,
Under Armour Volleyball Arm Sleeves,$12.99 ,Arm sleeves designed for added comfort and protection during play.,,,
Wilson AVP Outdoor Volleyball,$39.99 ,Durable outdoor volleyball for beach play.,,,
Spalding 4-Player Volleyball Set,$129.99 ,Complete volleyball set with a net, ball, and accessories for four players.,
Mikasa Special Edition Volleyball,$49.99 ,Limited edition volleyball designed for collectors and players.,,,
Volleyball Net Tensioner,$39.99 ,Adjustable net tensioner for setting the net at the perfect height.,,,
Nike Court Volleyball Shoes,$89.99 ,Sturdy shoes designed for grip and stability on indoor volleyball courts.,,,
Molten Beach Volleyball,$29.99 ,Soft-touch volleyball designed for beach play and outdoor conditions.,,,
Tachikara Premium Leather Volleyball,$39.99 ,High-quality leather volleyball designed for indoor and competitive play.,,,
Wilson Ultimate Volleyball,$44.99 ,High-performance volleyball for players at any skill level.,,,
Mikasa Beach Volleyball Set,$139.99 ,Complete set with net, poles, and ball designed for beach volleyball.,
Spalding Tournament Volleyball,$59.99 ,High-quality volleyball designed for tournament-level play.,,,
Adidas Volleyball Backpack,$49.99 ,Stylish and practical backpack for carrying your volleyball gear.,,,
Kemp Professional Volleyball Kneepads,$19.99 ,High-quality kneepads offering maximum comfort and protection.,,,
Tachikara Outdoor Volleyball Set,$89.99 ,Complete volleyball set for outdoor recreational play.,,,
Molten Street Beach Volleyball,$34.99 ,Durable and high-performance beach volleyball for outdoor use.,,,
Nike Dri-FIT Volleyball Shorts,$24.99 ,Comfortable and breathable shorts designed for volleyball athletes.,,,
Wilson Official Competition Volleyball,$59.99 ,Official competition volleyball for serious indoor play.,,,
Mikasa Sports Performance Volleyball,$39.99 ,High-performance volleyball ideal for both indoor and outdoor play.,,,
Tachikara Padded Volleyball Bag,$34.99 ,Spacious padded bag to carry your volleyball gear safely.,,,
Spalding Pro-Style Volleyball Set,$159.99 ,Professional volleyball set with high-quality net, poles, and ball.,
Nike Training Volleyball Shoes,$79.99 ,Comfortable and responsive volleyball shoes designed for training.,,,
Wilson Classic Volleyball,$29.99 ,Classic volleyball with great durability for recreational play.,,,
Molten FIBA Official Game Ball,$79.99 ,The official ball used in international volleyball tournaments.,,,
Mikasa Pro Beach Volleyball,$59.99 ,High-quality beach volleyball with an excellent grip for outdoor play.,,,
Spalding Endurance Volleyball,$34.99 ,Durable volleyball designed to withstand intense indoor practice.,,,
Champion Sports Volleyball Training Net,$49.99 ,Adjustable net designed for volleyball training drills.,,,
Tachikara SV5WB Soft Touch Volleyball,$19.99 ,Soft-touch volleyball ideal for beginners or recreational use.,,,
Molten Indoor Volleyball,$49.99 ,Professional-level volleyball for indoor competitions.,,,
Nike Volleyball Grip Tape,$7.99 ,Sticky grip tape for improving control of the volleyball.,,,
Wilson Beach Volleyball Net Set,$179.99 ,Complete volleyball net set designed for beach courts.,,,
Tachikara Official Game Volleyball,$32.99 ,Official game ball used in high school and collegiate volleyball.,,,
Mikasa Outdoor Volleyball,$29.99 ,Durable volleyball for recreational and competitive outdoor play.,,,
Under Armour Youth Volleyball Shorts,$19.99 ,Youth-sized shorts for volleyball with an elastic waistband for comfort.,,,
